{
  "contract": "akouo/agent-native-evidence/v1",
  "status": "unvalidated",
  "record_note": "Standalone deterministic demonstration, not an agent listening and not a complete Akousma. No physical acoustic capture or human hearing was tested.",
  "clocks": [
    {
      "id": "clock:virtual",
      "domain": "source",
      "unit": "s",
      "origin": "zero at beginning of generated one-second buffer",
      "alignment_note": "Single deterministic array timebase. No wall-clock or cross-sensor synchrony claim."
    }
  ],
  "evidence_objects": [
    {
      "id": "ev:native",
      "register": "digital_waveform",
      "artifact_ref": "synthetic_probe.py#run",
      "clock_id": "clock:virtual",
      "parent_ids": [],
      "units": "normalized_amplitude",
      "sample_rate_hz": 192000,
      "retained_band_hz": [
        0,
        80000
      ],
      "band_basis": "Conservative declared analysis band for the generated waveform; not physical calibration.",
      "transform_note": "x = 0.1*sin(2*pi*1000*t) + 0.1*sin(2*pi*40000*t), one second.",
      "sha256": "f7585c981421c3a48d0dfb78ba0863798dc0d18a2a248fa0993a5637aaa1c269"
    },
    {
      "id": "ev:filtered",
      "register": "digital_waveform",
      "artifact_ref": "synthetic_probe.py#run",
      "clock_id": "clock:virtual",
      "parent_ids": [
        "ev:native"
      ],
      "units": "normalized_amplitude",
      "sample_rate_hz": 48000,
      "retained_band_hz": [
        0,
        20000
      ],
      "band_basis": "Conservative retained analysis band; explicit FIR filtering before downsampling.",
      "transform_note": "scipy.signal.resample_poly(up=1, down=4, window=(kaiser,8.6)); see pinned results environment."
    },
    {
      "id": "ev:results",
      "register": "sonic_analysis",
      "artifact_ref": "synthetic_results.json",
      "clock_id": "clock:virtual",
      "parent_ids": [
        "ev:native",
        "ev:filtered"
      ],
      "units": "mixed; each metric declares its own unit",
      "band_basis": "Not a waveform: measurements and aperture-test outcomes.",
      "transform_note": "Deterministic calculation receipt, not additional acoustic evidence."
    }
  ],
  "apertures": [
    {
      "id": "ap:complex",
      "evidence_id": "ev:native",
      "observer_ref": "fixture:dsp",
      "status": "available",
      "available_band_hz": [
        0,
        80000
      ],
      "phase_preserved": true,
      "limitations": [
        "No agent, physical microphone, room, or sound pressure calibration."
      ]
    }
  ],
  "observations": [
    {
      "id": "obs:40k",
      "evidence_id": "ev:native",
      "aperture_id": "ap:complex",
      "clock_id": "clock:virtual",
      "source_interval_s": [
        0,
        1
      ],
      "spectral_interval_hz": [
        40000,
        40000
      ],
      "method": "Hann-weighted sinusoidal projection at a predeclared test frequency",
      "method_version": "synthetic_probe/v0.1",
      "metrics": [
        {
          "name": "estimated_sinusoid_amplitude",
          "value": 0.09999999999999964,
          "unit": "normalized_amplitude"
        }
      ],
      "access": [
        {
          "observer_ref": "fixture:dsp",
          "access": "native_computable",
          "basis": "Calculation was executed against the full-rate digital buffer."
        },
        {
          "observer_ref": "human:unspecified",
          "access": "not_rendered",
          "basis": "No acoustic playback or person-specific audibility test occurred."
        }
      ]
    }
  ],
  "relations": [
    {
      "id": "rel:filter",
      "from_ref": "ev:filtered",
      "to_ref": "ev:native",
      "kind": "derived_from",
      "basis": "from_ref was computed from to_ref by the declared filter/downsampling operation.",
      "evidence_refs": [
        "ev:results"
      ]
    }
  ],
  "human_projections": [
    {
      "id": "projection:40k",
      "source_refs": [
        "ev:native"
      ],
      "status": "proposed",
      "kind": "audification",
      "mapping": "Isolate the 40 kHz component, then slow the isolated signal by 10x to center it at 4 kHz. Keep native evidence separate.",
      "losses": [
        "Absolute pitch and event duration are changed.",
        "Other sources are excluded by the initial selection."
      ]
    }
  ],
  "limitations": [
    "This companion is not an adopted AKOÚŌ contract and has not been round-tripped through Oída or Earworm.",
    "Local IDs resolve inside this fixture; external claim/pass references are intentionally absent.",
    "A zero-width spectral selector names the test frequency, not zero measurement uncertainty.",
    "Native buffers are regenerated by the script, not retained as audio files."
  ]
}
